1,0,2,5e7e4f4c31f4e454e196c9c4,newLion,2020-04-20 18:59:14.855000+00:00,i think the mother needs to find an alternative,0.6,0,0.0,5,i think the mother needs to find an alternative,9,47,1,-0.6060598052592908,-0.568898240584487,0.009999999999999998,0.0,0.0,0.0,4.28,0.0,0.0,0.0,0.0,0.0,0.0,0.0,0.0,0.0,0.0,0.0,0.0,0.009999999999999998,0.0,0.0,0.0,0.019999999999999997,0.0,0.019999999999999997,0.0,0.0,0.0,0.0,0.0,0.0,0.009999999999999998,0.0,0.0,0.0,0.0,0.0,0.0,0.009999999999999998,0.0,0.0,0.0,0.019999999999999997,0.0,0.019999999999999997,0.0,0.0,0.029999999999999995,0.009999999999999998,0.0,0.0,0.0,0.0,0.009999999999999998,0.039999999999999994,0.0,0,0,1.0,0.1111111111111111,0,0.01639344262295082,0,0.0,0.0,5.837344444444444,medium,1.56,0,0,1,0,1,0,0,0,0,0,0,1,0,0,0,0,0,0,0,0,0
1,0,2,5d6feec65f80ae21f5c5f054,conventionalMonkey,2020-04-20 18:59:29.946000+00:00,her stance is probably more of a culture perspective than an assholey one,0.6,0,0.0,5,her stance is probably more of a culture perspective than an asshole-y one.,13,73,1,-0.17188106737043404,-0.09830226951276061,0.0,0.0,0.0,0.0,4.67,0.0,0.0,0.0,0.009999999999999998,0.0,0.009999999999999998,0.0,0.009999999999999998,0.0,0.0,0.0,0.0,0.0,0.0,0.009999999999999998,0.0,0.0,0.0,0.009999999999999998,0.0,0.0,0.0,0.0,0.0,0.0,0.019999999999999997,0.0,0.0,0.0,0.0,0.0,0.009999999999999998,0.0,0.0,0.009999999999999998,0.0,0.009999999999999998,0.0,0.019999999999999997,0.0,0.009999999999999998,0.009999999999999998,0.019999999999999997,0.0,0.0,0.0,0.009999999999999998,0.0,0.06999999999999999,0.009999999999999998,0,0,1.0,0.0,1,0.0,1,0.5,0.5,0.6447999999999999,easy,15.091,0,0,1,0,0,0,0,0,0,0,0,0,0,0,0,0,0,0,0,0,0
1,0,2,5e84cc3c50f6e364321d6265,likelyRabbit,2020-04-20 18:59:35.400000+00:00,i havent personally gone for my masters but i have gone to college  thats a ton of work shes doing,0.6,0,0.0,5,i haven't personally gone for my masters but i have gone to college.  that's a ton of work she's doing.,20,98,1,0.17546192294065138,0.2781745073446205,0.0,0.0,0.0,0.009999999999999998,0.0,0.0,0.0,0.019999999999999997,0.0,0.0,0.009999999999999998,0.009999999999999998,0.0,0.0,0.0,0.0,0.0,0.0,0.0,0.009999999999999998,0.0,0.0,0.0,0.039999999999999994,0.0,0.019999999999999997,0.019999999999999997,0.0,0.0,0.0,0.009999999999999998,0.009999999999999998,0.0,0.03,0.0,0.0,0.0,0.03,0.0,0.0,0.009999999999999998,0.06999999999999999,0.0,0.009999999999999998,0.009999999999999998,0.05,0.009999999999999998,0.03,0.0,0.0,0.0,0.03,0.03,0.1,0.0,0,0,0.9,0.15,2,0.0,0,0.3,0.0,0.992,easy,5.454,0,0,0,0,0,0,0,0,0,0,1,1,0,0,0,0,0,1,0,0,0
1,0,2,5e7e4f4c31f4e454e196c9c4,newLion,2020-04-20 18:59:40.967000+00:00,the have google translator on phones,0.6,0,0.0,5,the have google translator on phones,6,36,1,-0.7797313004148335,-0.7571366290131776,0.0,0.0,0.0,0.0,0.0,0.0,0.0,0.0,0.0,0.0,0.0,0.0,0.0,0.0,0.0,0.0,0.0,0.0,0.0,0.0,0.0,0.0,0.0,0.009999999999999998,0.0,0.0,0.009999999999999998,0.0,0.0,0.0,0.009999999999999998,0.0,0.0,0.0,0.0,0.0,0.0,0.0,0.0,0.0,0.0,0.009999999999999998,0.0,0.009999999999999998,0.0,0.009999999999999998,0.0,0.009999999999999998,0.0,0.0,0.0,0.0,0.0,0.03,0.0,0,0,1.0,0.0,1,0.0,0,0.0,0.0,0.2976,easy,5.567,0,0,0,0,0,0,0,0,0,0,0,0,0,0,0,0,0,0,0,0,0
1,0,2,5d482ea421c9be351f762255,newPanda,2020-04-20 18:59:47.848000+00:00,we are only hearing her side of it too i agree newlion  the mil could find other people to translate,0.6,0,0.0,5,we are only hearing her side of it too. i agree newlion  the mil could find other people to translate.,20,100,1,0.3491334180961941,0.4664128957733111,0.01,0.01,0.0,0.0,6.56,0.01,0.0,0.0,0.02,0.0,0.01,0.0,0.0,0.0,0.0,0.0,0.0,0.0,0.0,0.0,0.01,0.01,0.01,0.01,0.0,0.0,0.01,0.0,0.0,0.0,0.04,0.02,0.0,0.0,0.0,0.0,0.0,0.01,0.0,0.0,0.0,0.02,0.0,0.01,0.0,0.02,0.03,0.02,0.01,0.01,0.0,0.0,0.02,0.11,0.0,0,0,1.0,0.05,1,0.0,0,0.6875,-0.0625,0.992,easy,6.881,0,0,0,0,0,0,0,0,0,1,1,0,0,0,0,0,0,0,0,0,0
1,0,2,5e31d6e4e31c5304c46f1413,littleCow,2020-04-20 19:00:01.357000+00:00,i feel there is also some cultural things that need to be taken into account there maybe a difference between hers and her husbands but i dont think that makes her an asshole,0.6,0,0.0,5,"i feel there is also some cultural things that need to be taken into account. there maybe a difference between hers and her husband's, but i don't think that makes her an asshole.",33,174,1,1.3911623890294504,1.5958432263454545,0.01,0.0,0.0,0.03,5.3100000000000005,0.02,0.0,0.0,0.04,0.0,0.03,0.01,0.01,0.0,0.0,0.0,0.0,0.01,0.0,0.02,0.0,0.02,0.0,0.06,0.0,0.01,0.01,0.0,0.0,0.0,0.049999999999999996,0.03,0.0,0.0,0.01,0.01,0.01,0.02,0.01,0.02,0.01,0.08,0.0,0.02,0.02,0.03,0.09999999999999999,0.03,0.0,0.01,0.0,0.01,0.02,0.19,0.01,0,0,0.8787878787878788,0.06060606060606061,3,0.03278688524590164,1,0.1,0.1,1.6368,easy,13.509,0,0,1,0,1,0,0,0,0,0,1,1,0,0,0,0,0,0,0,0,0
1,0,2,5e7e4f4c31f4e454e196c9c4,newLion,2020-04-20 19:00:11.560000+00:00,i say nice asshole,0.6,0,0.0,5,i say nice asshole,4,18,1,-1.0402385431481476,-1.0394942116562134,0.0,0.009999999999999998,0.0,0.0,0.0,0.0,0.0,0.0,0.0,0.0,0.0,0.0,0.009999999999999998,0.0,0.0,0.0,0.0,0.0,0.0,0.0,0.009999999999999998,0.0,0.0,0.0,0.0,0.0,0.0,0.0,0.0,0.0,0.009999999999999998,0.0,0.0,0.0,0.0,0.0,0.009999999999999998,0.009999999999999998,0.0,0.0,0.0,0.0,0.0,0.0,0.0,0.0,0.0,0.0,0.0,0.009999999999999998,0.0,0.009999999999999998,0.009999999999999998,0.009999999999999998,0.0,0,0,1.0,0.25,0,0.05087620124364048,0,1.0,0.6,0.1984,easy,10.203,0,0,0,0,0,0,0,0,0,0,0,1,0,0,0,0,0,1,0,0,0
1,0,2,5d6feec65f80ae21f5c5f054,conventionalMonkey,2020-04-20 19:00:11.565000+00:00,i think she should ask her husband when and if hes available to translate beforehand,0.6,0,0.0,5,i think she should ask her husband when and if he's available to translate beforehand.,15,84,1,-0.08504531979266268,-0.004183075298415331,0.019999999999999997,0.0,0.0,0.03,4.28,0.009999999999999998,0.0,0.0,0.009999999999999998,0.0,0.03,0.0,0.0,0.0,0.0,0.0,0.0,0.009999999999999998,0.0,0.0,0.0,0.009999999999999998,0.0,0.03,0.009999999999999998,0.0,0.009999999999999998,0.0,0.0,0.0,0.049999999999999996,0.0,0.0,0.0,0.0,0.0,0.0,0.009999999999999998,0.0,0.009999999999999998,0.009999999999999998,0.039999999999999994,0.0,0.0,0.009999999999999998,0.019999999999999997,0.039999999999999994,0.009999999999999998,0.0,0.0,0.0,0.009999999999999998,0.009999999999999998,0.07999999999999999,0.0,0,0,1.0,0.06666666666666667,0,0.01639344262295082,0,0.4,0.4,0.744,easy,0.005,0,0,1,0,1,0,0,0,0,0,0,1,0,0,0,0,0,1,0,0,0
1,0,2,5e8b6dd0b35db8283c501b7a,likelyGorilla,2020-04-20 19:00:30.041000+00:00,she should expect to do more herself than expecting her husband to help every time once in a while if the husband can be of help then its great but cant be expected to help all the time when she just passes on,0.6,0,0.0,5,"she should expect to do more herself than expecting her husband to help every time. once in a while, if the husband can be of help, then it's great. but can't be expected to help all the time, when she ""just passes on""",43,209,1,2.4331913599627066,2.725273556917598,0.049999999999999996,0.0,0.0,0.049999999999999996,5.3999999999999995,0.0,0.0,0.0,0.019999999999999997,0.0,0.039999999999999994,0.009999999999999998,0.0,0.0,0.0,0.0,0.0,0.019999999999999997,0.0,0.019999999999999997,0.009999999999999998,0.0,0.0,0.03,0.009999999999999998,0.0,0.09,0.0,0.0,0.0,0.09,0.009999999999999998,0.0,0.0,0.0,0.0,0.0,0.0,0.0,0.009999999999999998,0.03,0.06,0.0,0.03,0.019999999999999997,0.06,0.09,0.06999999999999999,0.0,0.0,0.0,0.019999999999999997,0.0,0.29,0.0,0,0,0.7906976744186046,0.0,9,0.14285714285714285,0,0.5499999999999999,0.39999999999999997,2.1328,easy,18.476,0,0,1,0,0,0,0,0,0,0,0,0,0,0,0,0,0,1,0,0,0
1,0,2,5e84cc3c50f6e364321d6265,likelyRabbit,2020-04-20 19:00:32.376000+00:00,newlion great point  maybe they can educate her mom,0.6,0,0.0,5,newlion great point.  maybe they can educate her mom.,9,51,1,-0.5192240576815195,-0.47477904637014173,0.0,0.0,0.0,0.0,3.79,0.0,0.0,0.0,0.01,0.0,0.01,0.0,0.0,0.0,0.0,0.0,0.0,0.01,0.0,0.0,0.01,0.0,0.0,0.01,0.0,0.0,0.01,0.0,0.0,0.0,0.03,0.0,0.0,0.01,0.0,0.0,0.0,0.0,0.0,0.01,0.0,0.01,0.0,0.0,0.0,0.01,0.01,0.0,0.0,0.0,0.0,0.01,0.0,0.03,0.01,0,0,1.0,0.0,2,0.3333333333333333,1,0.75,0.8,0.44639999999999996,easy,2.335,0,0,1,0,0,0,0,0,0,0,0,0,0,0,0,0,0,1,0,0,0
1,0,2,5d6feec65f80ae21f5c5f054,conventionalMonkey,2020-04-20 19:00:40.756000+00:00,just having mom call out of the blue is unacceptable to me,0.6,0,0.0,5,just having mom call out of the blue is unacceptable to me.,12,58,1,-0.25871681494820536,-0.1924214637271059,0.0,0.0,0.0,0.0,0.0,0.009999999999999998,0.0,0.0,0.009999999999999998,0.0,0.0,0.0,0.0,0.0,0.0,0.009999999999999998,0.0,0.009999999999999998,0.0,0.0,0.0,0.009999999999999998,0.0,0.009999999999999998,0.0,0.0,0.009999999999999998,0.0,0.0,0.0,0.019999999999999997,0.0,0.0,0.0,0.0,0.0,0.0,0.009999999999999998,0.0,0.0,0.009999999999999998,0.019999999999999997,0.0,0.009999999999999998,0.009999999999999998,0.019999999999999997,0.03,0.03,0.0,0.009999999999999998,0.0,0.0,0.009999999999999998,0.07999999999999999,0.0,0,0,1.0,0.0,0,0.5,0,0.1,0.0,5.547533333333333,medium,8.38,0,0,0,0,0,0,0,0,0,0,0,0,0,0,0,0,0,0,1,0,0
1,0,2,5e7e4f4c31f4e454e196c9c4,newLion,2020-04-20 19:00:55.905000+00:00,but the mother quit going through the daughter and started calling him directly,0.6,0,0.0,5,but the mother quit going through the daughter and started calling him directly.,13,79,1,-0.17188106737043404,-0.09830226951276061,0.0,0.0,0.0,0.02,0.0,0.01,0.0,0.01,0.0,0.0,0.01,0.0,0.0,0.0,0.0,0.0,0.0,0.02,0.0,0.0,0.0,0.0,0.0,0.0,0.0,0.01,0.02,0.0,0.0,0.0,0.04,0.0,0.0,0.0,0.0,0.0,0.0,0.0,0.0,0.0,0.01,0.01,0.0,0.02,0.02,0.0,0.030000000000000002,0.01,0.0,0.0,0.0,0.0,0.0,0.060000000000000005,0.0,0,0,0.9230769230769231,0.0,2,0.0,0,0.4,0.1,0.6447999999999999,easy,15.149,0,0,0,0,0,0,0,0,0,0,0,0,0,0,0,0,1,0,0,0,0
1,0,2,5d6feec65f80ae21f5c5f054,conventionalMonkey,2020-04-20 19:01:21.636000+00:00,i have considered both sides while i dont dislike this person i think her expectations of her husband are somewhat assholey,0.6,0,0.0,5,"i have considered both sides. while i don't dislike this person, i think her expectations of her husband are somewhat asshole-y.",21,123,1,0.26229767051842273,0.3722937015589658,0.01,0.0,0.0,0.01,5.5649999999999995,0.01,0.0,0.0,0.0,0.0,0.02,0.01,0.01,0.0,0.0,0.0,0.0,0.01,0.01,0.02,0.0,0.02,0.01,0.049999999999999996,0.0,0.0,0.03,0.0,0.0,0.0,0.04,0.01,0.0,0.0,0.0,0.0,0.01,0.03,0.0,0.01,0.0,0.049999999999999996,0.0,0.0,0.0,0.03,0.049999999999999996,0.01,0.0,0.0,0.0,0.0,0.03,0.11,0.0,0,0,0.8571428571428571,0.14285714285714285,0,0.0,0,0.0,0.0,1.793504761904762,easy,25.731,0,0,1,0,1,0,0,0,0,0,1,1,0,0,0,0,0,0,1,0,0
1,0,2,5e7e4f4c31f4e454e196c9c4,newLion,2020-04-20 19:01:40.801000+00:00,i say asshole,0.6,0,0.0,5,i say asshole,3,13,1,-1.127074290725919,-1.1336134058705587,0.0,0.01,0.0,0.0,0.0,0.0,0.0,0.0,0.0,0.0,0.0,0.0,0.01,0.0,0.0,0.0,0.0,0.0,0.0,0.0,0.0,0.0,0.0,0.0,0.0,0.0,0.0,0.0,0.0,0.0,0.01,0.0,0.0,0.0,0.0,0.0,0.01,0.01,0.0,0.0,0.0,0.0,0.0,0.0,0.0,0.0,0.0,0.0,0.0,0.01,0.0,0.0,0.01,0.01,0.0,0,0,1.0,0.3333333333333333,0,0.01639344262295082,0,0.0,0.0,0.1488,easy,19.165,0,0,0,0,0,0,0,0,0,0,0,1,0,0,0,0,0,0,0,0,0
1,0,2,5d6feec65f80ae21f5c5f054,conventionalMonkey,2020-04-20 19:01:45.458000+00:00,i think the daughter made the mother think it was okay to just call directly,0.6,0,0.0,5,i think the daughter made the mother think it was okay to just call directly.,15,76,1,-0.08504531979266268,-0.004183075298415331,0.0,0.0,0.0,0.0,5.805,0.0,0.0,0.0,0.01,0.0,0.0,0.0,0.0,0.0,0.0,0.0,0.0,0.02,0.0,0.0,0.01,0.02,0.0,0.02,0.0,0.02,0.0,0.0,0.0,0.0,0.03,0.01,0.0,0.0,0.0,0.01,0.0,0.01,0.0,0.0,0.01,0.04,0.0,0.02,0.01,0.01,0.049999999999999996,0.01,0.0,0.0,0.0,0.0,0.01,0.06999999999999999,0.0,0,0,0.8666666666666667,0.06666666666666667,0,0.01639344262295082,0,0.45,0.3,0.744,easy,4.657,0,0,1,0,1,0,0,0,0,0,0,1,0,0,0,0,0,0,0,0,0
1,0,2,5e84cc3c50f6e364321d6265,likelyRabbit,2020-04-20 19:01:54.179000+00:00,i still say not an asshole  shes very busy,0.6,0,0.0,5,i still say not an asshole.  she's very busy.,9,42,1,-0.6060598052592908,-0.568898240584487,0.0,0.009999999999999998,0.0,0.0,0.0,0.0,0.0,0.0,0.019999999999999997,0.0,0.009999999999999998,0.009999999999999998,0.009999999999999998,0.0,0.0,0.0,0.0,0.0,0.0,0.0,0.0,0.0,0.0,0.009999999999999998,0.0,0.0,0.019999999999999997,0.0,0.0,0.0,0.019999999999999997,0.0,0.0,0.009999999999999998,0.0,0.0,0.009999999999999998,0.009999999999999998,0.0,0.0,0.009999999999999998,0.009999999999999998,0.0,0.009999999999999998,0.0,0.009999999999999998,0.009999999999999998,0.0,0.0,0.009999999999999998,0.0,0.0,0.009999999999999998,0.039999999999999994,0.0,0,0,1.0,0.1111111111111111,0,0.01639344262295082,0,0.39,0.13,0.44639999999999996,easy,8.721,0,0,0,0,0,0,0,0,0,0,0,1,0,0,0,0,0,0,0,0,0
1,0,2,5d6feec65f80ae21f5c5f054,conventionalMonkey,2020-04-20 19:02:01.093000+00:00,shes so busy she wanted to stop being the middleman,0.6,0,0.0,5,"she's so busy, she wanted to stop being the middleman.",10,51,1,-0.4323883101037481,-0.38065985215579645,0.01,0.0,0.0,0.01,0.0,0.0,0.0,0.0,0.01,0.0,0.02,0.0,0.0,0.0,0.0,0.0,0.0,0.0,0.0,0.0,0.0,0.0,0.0,0.01,0.0,0.01,0.03,0.0,0.01,0.0,0.02,0.0,0.0,0.01,0.0,0.0,0.0,0.0,0.0,0.0,0.0,0.03,0.0,0.01,0.01,0.02,0.02,0.01,0.0,0.0,0.0,0.0,0.0,0.05,0.0,0,0,1.0,0.0,1,0.16666666666666666,0,0.3,0.1,0.496,easy,6.914,0,0,0,0,0,0,0,0,0,0,0,0,0,0,0,0,0,0,0,0,0
1,0,2,5d482ea421c9be351f762255,newPanda,2020-04-20 19:02:18.356000+00:00,i understand wanting to help her parents but i think there is also an issue with this woman using her husband she is an asshole,0.6,0,0.0,5,i understand wanting to help her parents but i think there is also an issue with this woman using her husband. she is an asshole.,25,127,1,0.6964764084072795,0.8428896726306921,0.01,0.0,0.0,0.02,4.28,0.01,0.0,0.0,0.02,0.0,0.03,0.0,0.01,0.0,0.0,0.0,0.0,0.02,0.0,0.0,0.0,0.02,0.01,0.05,0.0,0.0,0.0,0.0,0.0,0.0,0.07,0.01,0.0,0.0,0.0,0.01,0.01,0.02,0.0,0.0,0.01,0.05,0.0,0.02,0.01,0.02,0.07,0.02,0.0,0.0,0.0,0.0,0.02,0.14,0.0,0,0,0.84,0.08,2,0.0,0,0.0,0.0,1.24,easy,17.263,0,0,1,0,1,0,0,0,0,0,1,1,0,0,0,0,0,0,1,0,0
1,0,2,5e8b6dd0b35db8283c501b7a,likelyGorilla,2020-04-20 19:02:21.314000+00:00,every relationship has limitation in terms of expectation if the husband willingly helps thats great if not she should nicely try to approach him for helping out,0.6,0,0.0,5,"every relationship has limitation in terms of expectation. if the husband willingly helps, that's great. if not, she should nicely try to approach him for helping out",27,161,1,1.043819398718365,1.2193664494880734,0.04,0.0,0.0,0.02,0.0,0.01,0.0,0.02,0.0,0.0,0.02,0.01,0.0,0.0,0.0,0.0,0.0,0.01,0.0,0.01,0.04,0.0,0.0,0.04,0.01,0.0,0.030000000000000002,0.0,0.01,0.0,0.060000000000000005,0.01,0.0,0.0,0.0,0.0,0.0,0.0,0.0,0.02,0.030000000000000002,0.05,0.0,0.01,0.0,0.030000000000000002,0.08,0.05,0.0,0.0,0.0,0.04,0.0,0.13,0.0,0,0,0.9629629629629629,0.0,2,0.07142857142857142,0,0.8333333333333334,0.5499999999999999,6.730144444444444,difficult,2.958,0,0,1,0,0,0,0,0,0,0,0,0,0,0,0,0,0,1,1,0,0
1,0,2,5d6feec65f80ae21f5c5f054,conventionalMonkey,2020-04-20 19:02:22.733000+00:00,asshole with reservations from me,0.6,0,0.0,5,asshole with reservations from me.,5,33,1,-0.8665670479926049,-0.8512558232275228,0.0,0.0,0.0,0.0,4.67,0.01,0.0,0.0,0.0,0.0,0.0,0.0,0.01,0.0,0.0,0.0,0.0,0.0,0.0,0.0,0.0,0.0,0.0,0.0,0.0,0.0,0.0,0.0,0.0,0.0,0.0,0.0,0.0,0.0,0.0,0.0,0.01,0.01,0.0,0.0,0.0,0.0,0.0,0.0,0.0,0.0,0.01,0.02,0.0,0.0,0.0,0.0,0.01,0.030000000000000002,0.0,0,0,1.0,0.0,0,0.0,0,0.0,0.0,7.0425,difficult,1.419,0,0,0,0,0,0,0,0,0,0,0,0,0,0,0,0,0,0,0,0,0
1,0,2,5e7e4f4c31f4e454e196c9c4,newLion,2020-04-20 19:02:26.402000+00:00,maybe she needs to take some off her plate,0.6,0,0.0,5,maybe she needs to take some off her plate,9,42,1,-0.5192240576815195,-0.47477904637014173,0.009999999999999998,0.0,0.0,0.0,3.79,0.0,0.0,0.0,0.009999999999999998,0.0,0.019999999999999997,0.0,0.0,0.0,0.0,0.0,0.0,0.0,0.0,0.009999999999999998,0.0,0.0,0.0,0.019999999999999997,0.0,0.0,0.009999999999999998,0.0,0.0,0.0,0.019999999999999997,0.0,0.0,0.0,0.0,0.0,0.0,0.0,0.0,0.019999999999999997,0.0,0.019999999999999997,0.0,0.0,0.0,0.0,0.03,0.019999999999999997,0.0,0.0,0.0,0.0,0.0,0.049999999999999996,0.009999999999999998,0,0,1.0,0.0,0,0.0,1,0.0,0.0,0.44639999999999996,easy,3.669,0,0,1,0,0,0,0,0,0,0,0,0,0,0,0,0,0,0,0,0,0
1,0,2,5e31d6e4e31c5304c46f1413,littleCow,2020-04-20 19:02:30.624000+00:00,yeah im not convinced shes an asshole i do think the situation could be settled in a way thats more ideal to both parties but shes working full time and going through her masters which is a lot,0.6,0,0.0,5,"yeah, i'm not convinced she's an asshole. i do think the situation could be settled in a way that's more ideal to both parties, but she's working full time and going through her master's which is a lot.",38,193,1,1.9121768744960785,2.1605583916315263,0.02,0.0,0.0,0.02,6.3340000000000005,0.02,0.0,0.03,0.0,0.0,0.03,0.01,0.01,0.0,0.0,0.0,0.0,0.0,0.0,0.04,0.03,0.01,0.0,0.06,0.0,0.0,0.06,0.0,0.0,0.0,0.04,0.02,0.0,0.02,0.0,0.0,0.01,0.01,0.0,0.01,0.02,0.08,0.0,0.04,0.02,0.06999999999999999,0.08,0.03,0.0,0.0,0.0,0.04,0.01,0.18,0.0,0,0,0.9473684210526315,0.02631578947368421,2,0.0,0,0.6833333333333332,0.5833333333333334,1.8848,easy,4.222,0,0,1,0,1,0,0,0,0,0,1,0,0,0,0,0,1,1,0,0,0
1,0,2,5d6feec65f80ae21f5c5f054,conventionalMonkey,2020-04-20 19:02:46.021000+00:00,if only there was choice beside yay or nay,0.6,0,0.0,5,if only there was choice beside yay or nay.,9,42,1,-0.5192240576815195,-0.47477904637014173,0.009999999999999998,0.0,0.0,0.019999999999999997,0.0,0.0,0.0,0.0,0.019999999999999997,0.0,0.0,0.0,0.0,0.0,0.0,0.0,0.0,0.0,0.0,0.0,0.009999999999999998,0.009999999999999998,0.0,0.0,0.0,0.009999999999999998,0.009999999999999998,0.0,0.0,0.0,0.0,0.0,0.0,0.0,0.0,0.0,0.0,0.0,0.0,0.019999999999999997,0.019999999999999997,0.009999999999999998,0.0,0.0,0.0,0.009999999999999998,0.03,0.009999999999999998,0.0,0.0,0.0,0.009999999999999998,0.0,0.049999999999999996,0.0,0,0,1.0,0.0,0,0.0,0,1.0,0.0,0.44639999999999996,easy,15.397,0,0,0,0,0,0,0,0,0,0,0,0,0,0,0,0,0,1,0,0,0
1,0,2,5e84cc3c50f6e364321d6265,likelyRabbit,2020-04-20 19:02:48.819000+00:00,i agree littlecow,0.6,0,0.0,5,i agree littlecow,3,17,1,-1.127074290725919,-1.1336134058705587,0.0,0.0,0.0,0.0,0.0,0.0,0.0,0.0,0.0,0.0,0.0,0.0,0.0,0.0,0.0,0.0,0.0,0.0,0.0,0.0,0.01,0.0,0.0,0.0,0.0,0.0,0.01,0.0,0.0,0.0,0.0,0.0,0.0,0.0,0.0,0.0,0.0,0.01,0.0,0.0,0.0,0.0,0.0,0.0,0.0,0.0,0.0,0.0,0.0,0.0,0.0,0.0,0.01,0.01,0.0,0,0,1.0,0.3333333333333333,0,0.0,0,0.0,0.0,0.1488,easy,2.798,0,0,0,0,0,0,0,0,0,0,0,1,0,0,0,0,0,0,0,0,0
1,0,2,5e7e4f4c31f4e454e196c9c4,newLion,2020-04-20 19:02:55.111000+00:00,i say asshole under stress,0.6,0,0.0,5,i say asshole under stress,5,26,1,-0.9534027955703762,-0.9453750174418681,0.0,0.01,0.0,0.0,0.0,0.0,0.0,0.0,0.0,0.01,0.0,0.0,0.01,0.0,0.0,0.0,0.0,0.0,0.0,0.0,0.0,0.0,0.0,0.0,0.0,0.0,0.01,0.0,0.0,0.0,0.01,0.0,0.0,0.0,0.0,0.0,0.01,0.01,0.0,0.0,0.0,0.0,0.0,0.0,0.0,0.0,0.0,0.01,0.0,0.01,0.0,0.0,0.01,0.02,0.0,0,0,1.0,0.2,0,0.01639344262295082,0,0.0,0.0,0.248,easy,6.292,0,0,0,0,0,0,0,0,0,0,0,1,0,0,0,0,0,0,1,0,0
1,0,2,5d6feec65f80ae21f5c5f054,conventionalMonkey,2020-04-20 19:03:21.819000+00:00,yes she is the asshole unfortunately husband has stuff to do too and is entitled to not want to translate at her mothers whim,0.6,0,0.0,5,"yes, she is the asshole... unfortunately. husband has stuff to do too and is entitled to not want to translate at her mother's whim.",24,125,1,0.7833121559850509,0.9370088668450375,0.01,0.0,0.0,0.01,6.280000000000001,0.01,0.0,0.0,0.01,0.0,0.02,0.01,0.01,0.0,0.0,0.0,0.0,0.02,0.0,0.0,0.0,0.0,0.0,0.05,0.0,0.0,0.01,0.0,0.0,0.0,0.04,0.01,0.0,0.0,0.0,0.0,0.01,0.0,0.0,0.0,0.01,0.05,0.0,0.01,0.02,0.04,0.03,0.04,0.0,0.0,0.0,0.0,0.0,0.14,0.0,0,0,0.875,0.0,0,0.034482758620689655,0,1.0,-0.5,1.8483166666666664,easy,26.708,0,0,0,0,0,0,0,0,0,0,0,0,0,0,0,0,0,0,1,0,0
1,0,2,5d482ea421c9be351f762255,newPanda,2020-04-20 19:03:36.308000+00:00,i think she is being presumptuous and acting like her husbands feelings dont matter ,0.6,0,0.0,5,i think she is being presumptuous and acting like her husband's feelings don't matter. ,14,84,1,-0.17188106737043404,-0.09830226951276061,0.0,0.0,0.0,0.009999999999999998,4.28,0.009999999999999998,0.0,0.0,0.0,0.0,0.019999999999999997,0.009999999999999998,0.0,0.0,0.0,0.0,0.0,0.009999999999999998,0.0,0.0,0.009999999999999998,0.03,0.0,0.03,0.0,0.0,0.0,0.0,0.0,0.0,0.03,0.0,0.0,0.0,0.0,0.0,0.0,0.009999999999999998,0.009999999999999998,0.0,0.0,0.039999999999999994,0.0,0.0,0.009999999999999998,0.03,0.049999999999999996,0.0,0.0,0.009999999999999998,0.0,0.009999999999999998,0.009999999999999998,0.06,0.0,0,0,1.0,0.07142857142857142,4,0.0,0,0.0,0.0,5.458757142857143,medium,14.489,0,0,1,0,1,0,0,0,0,0,0,1,0,0,0,0,0,1,1,0,0
1,0,2,5e7e4f4c31f4e454e196c9c4,newLion,2020-04-20 19:03:53.219000+00:00,thas true she inst considering her husband and his feelings,0.6,0,0.0,5,"tha's true, she ins't considering her husband and his feelings",10,59,1,-0.4323883101037481,-0.38065985215579645,0.0,0.0,0.0,0.01,0.0,0.01,0.0,0.0,0.0,0.0,0.03,0.0,0.0,0.0,0.0,0.0,0.0,0.01,0.0,0.0,0.01,0.02,0.0,0.0,0.0,0.0,0.0,0.0,0.0,0.0,0.04,0.0,0.0,0.0,0.0,0.0,0.0,0.0,0.01,0.0,0.0,0.0,0.0,0.0,0.01,0.0,0.04,0.0,0.0,0.01,0.0,0.0,0.0,0.04,0.0,0,0,1.0,0.0,3,0.25,0,0.65,0.35,5.7115,medium,16.911,0,0,0,0,0,0,0,0,0,0,0,0,0,0,0,0,0,0,0,0,0
1,0,2,5e84cc3c50f6e364321d6265,likelyRabbit,2020-04-20 19:04:02.642000+00:00,i dont agree  not the asshole  shes too busy,0.6,0,0.0,5,i don't agree.  not the asshole.  she's too busy.,9,44,1,-0.6060598052592908,-0.568898240584487,0.0,0.0,0.0,0.0,0.0,0.0,0.0,0.0,0.01,0.0,0.01,0.02,0.01,0.0,0.0,0.0,0.0,0.0,0.0,0.0,0.01,0.0,0.0,0.02,0.0,0.0,0.01,0.0,0.0,0.0,0.01,0.0,0.0,0.01,0.0,0.0,0.01,0.01,0.0,0.0,0.01,0.02,0.0,0.01,0.0,0.02,0.01,0.0,0.0,0.0,0.0,0.0,0.01,0.04,0.0,0,0,1.0,0.1111111111111111,0,0.0,0,0.3,0.1,0.44639999999999996,easy,9.423,0,0,0,0,0,0,0,0,0,0,0,1,0,0,0,0,0,0,0,0,0
